{
  "schema_version": 1,
  "source": "중등 수학 70점 돌파 모의고사 v3 고난도",
  "notes": "기존 v2보다 난도를 높인 독창 문항 25개. 1~18번은 중1-2·중2-1·중2-2 각 6문항의 72점 회수 구간, 19~25번은 변별 구간이다. 모든 도형은 직접 작성했으며 문항 간 답 의존성이 없다.",
  "problems": [
    {
      "external_key": "math70-v3-hard-001",
      "title": "1. 중2-2 마름모와 피타고라스 정리",
      "body_html": "<p>마름모 ABCD의 두 대각선 AC, BD의 길이가 각각 10 cm, 24 cm이다. 이 마름모의 둘레는?</p>",
      "diagram_svg": "<svg viewBox=\"0 0 440 280\" role=\"img\" aria-label=\"두 대각선 AC와 BD의 길이가 각각 10센티미터와 24센티미터인 마름모 ABCD\" xmlns=\"http://www.w3.org/2000/svg\"><rect width=\"100%\" height=\"100%\" fill=\"#fff\"/><path d=\"M220 65L400 140L220 215L40 140Z\" fill=\"none\" stroke=\"#243b38\" stroke-width=\"3\"/><path d=\"M220 65V215M40 140H400\" fill=\"none\" stroke=\"#315e58\" stroke-width=\"3\" stroke-dasharray=\"9 6\"/><path d=\"M220 140h15v15\" fill=\"none\" stroke=\"#243b38\" stroke-width=\"3\"/><text x=\"214\" y=\"55\" font-family=\"sans-serif\" font-size=\"18\">A</text><text x=\"406\" y=\"145\" font-family=\"sans-serif\" font-size=\"18\">B</text><text x=\"214\" y=\"238\" font-family=\"sans-serif\" font-size=\"18\">C</text><text x=\"22\" y=\"145\" font-family=\"sans-serif\" font-size=\"18\">D</text><text x=\"105\" y=\"100\" font-family=\"sans-serif\" font-size=\"17\">AC = 10 cm</text><text x=\"285\" y=\"130\" font-family=\"sans-serif\" font-size=\"17\">BD = 24 cm</text></svg>",
      "grade": "중2",
      "semester": "2-2",
      "unit": "평행사변형과 피타고라스 정리",
      "tags": [
        "2-2",
        "평행사변형과 피타고라스 정리",
        "4점",
        "안전망 72점",
        "표준",
        "객관식"
      ],
      "answer_type": "choice",
      "choices": [
        "44 cm",
        "48 cm",
        "52 cm",
        "56 cm",
        "60 cm"
      ],
      "answer_spec": {
        "correct_index": 2
      },
      "explanation_html": "<ol><li>마름모의 두 대각선은 서로를 수직이등분하므로 교점에서 각 대각선은 5 cm, 12 cm로 나뉜다.</li><li>마름모의 한 변은 두 직각변이 5 cm, 12 cm인 직각삼각형의 빗변이므로 13 cm이다.</li><li>둘레는 13×4=52 cm이다.</li></ol><p><strong>정답</strong>: ③ 52 cm</p><p><strong>오답 기준</strong>: 대각선 전체 길이가 아니라 각각의 절반으로 한 변을 구한다.</p>",
      "level": 14,
      "base_xp": 80,
      "state": "published"
    },
    {
      "external_key": "math70-v3-hard-002",
      "title": "2. 중2-1 지수법칙과 식의 계산",
      "body_html": "<p>a≠0, b≠0일 때, {(-2a²b)³ ÷ (4ab²)} × (-3b/a)를 간단히 한 것은?</p>",
      "diagram_svg": "",
      "grade": "중2",
      "semester": "2-1",
      "unit": "식의 계산",
      "tags": [
        "2-1",
        "식의 계산",
        "4점",
        "안전망 72점",
        "준고난도",
        "객관식"
      ],
      "answer_type": "choice",
      "choices": [
        "−6a⁴b²",
        "6a⁵b²",
        "6a⁴b",
        "−6a⁵b",
        "6a⁴b²"
      ],
      "answer_spec": {
        "correct_index": 4
      },
      "explanation_html": "<ol><li>(−2a²b)³=−8a⁶b³이므로 이를 4ab²로 나누면 −2a⁵b이다.</li><li>−2a⁵b×(−3b/a)=6a⁴b²이다.</li></ol><p><strong>정답</strong>: ⑤ 6a⁴b²</p><p><strong>오답 기준</strong>: 세제곱을 계수와 모든 문자에 적용하고, 마지막에 a의 지수를 하나 줄인다.</p>",
      "level": 14,
      "base_xp": 80,
      "state": "published"
    },
    {
      "external_key": "math70-v3-hard-003",
      "title": "3. 중1-2 다각형의 내각",
      "body_html": "<p>볼록오각형의 다섯 내각의 크기가 차례로 (x+10)°, (x+20)°, (2x−10)°, 2x°, (3x−20)°이다. 가장 큰 내각과 가장 작은 내각의 크기의 차는?</p>",
      "diagram_svg": "",
      "grade": "중1",
      "semester": "1-2",
      "unit": "다각형",
      "tags": [
        "1-2",
        "다각형",
        "4점",
        "안전망 72점",
        "표준",
        "객관식"
      ],
      "answer_type": "choice",
      "choices": [
        "80°",
        "90°",
        "100°",
        "110°",
        "120°"
      ],
      "answer_spec": {
        "correct_index": 1
      },
      "explanation_html": "<ol><li>오각형의 내각의 합은 540°이므로 9x=540, x=60이다.</li><li>각은 70°, 80°, 110°, 120°, 160°이므로 차는 160°−70°=90°이다.</li></ol><p><strong>정답</strong>: ② 90°</p><p><strong>오답 기준</strong>: x를 구한 뒤 x 자체가 아니라 실제 각의 최댓값과 최솟값을 비교한다.</p>",
      "level": 11,
      "base_xp": 68,
      "state": "published"
    },
    {
      "external_key": "math70-v3-hard-004",
      "title": "4. 중2-1 일차부등식의 활용",
      "body_html": "<p>어떤 서비스를 x개월 이용할 때 요금제 A는 8000+900x원, 요금제 B는 3500+1400x원이다. A가 B보다 처음으로 저렴해지는 x의 최솟값은? (x는 양의 정수)</p>",
      "diagram_svg": "",
      "grade": "중2",
      "semester": "2-1",
      "unit": "일차부등식",
      "tags": [
        "2-1",
        "일차부등식",
        "4점",
        "안전망 72점",
        "표준",
        "객관식"
      ],
      "answer_type": "choice",
      "choices": [
        "8",
        "9",
        "9.5",
        "10",
        "11"
      ],
      "answer_spec": {
        "correct_index": 3
      },
      "explanation_html": "<ol><li>8000+900x&lt;3500+1400x에서 4500&lt;500x, 즉 x&gt;9이다.</li><li>x는 양의 정수이므로 최솟값은 10이다.</li></ol><p><strong>정답</strong>: ④ 10</p><p><strong>오답 기준</strong>: “저렴”은 등호 없는 부등식이며 x=9에서는 두 요금이 같다.</p>",
      "level": 12,
      "base_xp": 72,
      "state": "published"
    },
    {
      "external_key": "math70-v3-hard-005",
      "title": "5. 중1-2 도수분포와 평균",
      "body_html": "<p>다음은 값별 도수표이다. 평균이 3.8일 때, 값이 5 이상인 자료의 상대도수는?</p><table><caption>값별 도수</caption><thead><tr><th scope=\"col\">값</th><th scope=\"col\">1</th><th scope=\"col\">3</th><th scope=\"col\">5</th><th scope=\"col\">7</th></tr></thead><tbody><tr><th scope=\"row\">도수</th><td>4</td><td>a</td><td>6</td><td>2</td></tr></tbody></table>",
      "diagram_svg": "",
      "grade": "중1",
      "semester": "1-2",
      "unit": "자료의 정리와 해석",
      "tags": [
        "1-2",
        "자료의 정리와 해석",
        "4점",
        "안전망 72점",
        "준고난도",
        "객관식"
      ],
      "answer_type": "choice",
      "choices": [
        "8/15",
        "2/5",
        "3/5",
        "8/12",
        "7/15"
      ],
      "answer_spec": {
        "correct_index": 0
      },
      "explanation_html": "<ol><li>평균 조건에서 (48+3a)/(12+a)=3.8이다.</li><li>48+3a=45.6+3.8a이므로 a=3, 전체 도수는 15이다.</li><li>값이 5 이상인 도수는 6+2=8이므로 상대도수는 8/15이다.</li></ol><p><strong>정답</strong>: ① 8/15</p><p><strong>오답 기준</strong>: 미지의 도수를 먼저 구한 뒤 전체 도수에도 반영한다.</p>",
      "level": 15,
      "base_xp": 84,
      "state": "published"
    },
    {
      "external_key": "math70-v3-hard-006",
      "title": "6. 중2-2 사다리꼴과 닮음",
      "body_html": "<p>사다리꼴 ABCD에서 AB∥CD이고 두 대각선 AC, BD의 교점을 O라 하자. AB=8 cm, CD=20 cm, AO=6 cm일 때 OC의 길이를 구하시오.</p>",
      "diagram_svg": "<svg viewBox=\"0 0 440 280\" role=\"img\" aria-label=\"윗변 AB가 8센티미터, 아랫변 CD가 20센티미터이고 대각선의 교점 O에서 AO가 6센티미터인 사다리꼴 ABCD\" xmlns=\"http://www.w3.org/2000/svg\"><rect width=\"100%\" height=\"100%\" fill=\"#fff\"/><path d=\"M152 45H288L390 235H50Z\" fill=\"none\" stroke=\"#243b38\" stroke-width=\"3\"/><path d=\"M152 45L390 235M288 45L50 235\" fill=\"none\" stroke=\"#315e58\" stroke-width=\"3\" stroke-dasharray=\"9 6\"/><circle cx=\"220\" cy=\"99\" r=\"5\" fill=\"#243b38\"/><text x=\"137\" y=\"38\" font-family=\"sans-serif\" font-size=\"18\">A</text><text x=\"295\" y=\"38\" font-family=\"sans-serif\" font-size=\"18\">B</text><text x=\"397\" y=\"250\" font-family=\"sans-serif\" font-size=\"18\">C</text><text x=\"32\" y=\"250\" font-family=\"sans-serif\" font-size=\"18\">D</text><text x=\"228\" y=\"97\" font-family=\"sans-serif\" font-size=\"18\">O</text><text x=\"205\" y=\"33\" font-family=\"sans-serif\" font-size=\"17\">8 cm</text><text x=\"197\" y=\"263\" font-family=\"sans-serif\" font-size=\"17\">20 cm</text><text x=\"170\" y=\"70\" font-family=\"sans-serif\" font-size=\"17\">6 cm</text></svg>",
      "grade": "중2",
      "semester": "2-2",
      "unit": "삼각형의 닮음",
      "tags": [
        "2-2",
        "삼각형의 닮음",
        "4점",
        "안전망 72점",
        "준고난도",
        "단답형"
      ],
      "answer_type": "text",
      "choices": [],
      "answer_spec": {
        "accepted": [
          "15",
          "15cm",
          "15 cm"
        ],
        "partial": [],
        "rubric": ""
      },
      "explanation_html": "<ol><li>AB∥CD이므로 엇각과 맞꼭지각을 이용하면 △AOB∽△COD이다.</li><li>AO:OC=AB:CD=8:20=2:5이다.</li><li>AO=6 cm가 2에 해당하므로 OC=6×5/2=15 cm이다.</li></ol><p><strong>정답</strong>: 15 cm</p><p><strong>오답 기준</strong>: 닮은 삼각형의 대응 순서를 맞추어 AO와 OC를 각각 AB와 CD에 대응시킨다.</p>",
      "level": 17,
      "base_xp": 92,
      "state": "published"
    },
    {
      "external_key": "math70-v3-hard-007",
      "title": "7. 중1-2 입체도형의 부피",
      "body_html": "<p>밑면의 반지름이 3 cm이고 높이가 8 cm인 원기둥에서, 밑면의 중심이 같고 반지름이 3 cm, 높이가 6 cm인 원뿔 모양을 완전히 파냈다. 남은 입체의 부피는?</p>",
      "diagram_svg": "",
      "grade": "중1",
      "semester": "1-2",
      "unit": "입체도형의 측정",
      "tags": [
        "1-2",
        "입체도형의 측정",
        "4점",
        "안전망 72점",
        "표준",
        "객관식"
      ],
      "answer_type": "choice",
      "choices": [
        "18π cm³",
        "36π cm³",
        "54π cm³",
        "72π cm³",
        "90π cm³"
      ],
      "answer_spec": {
        "correct_index": 2
      },
      "explanation_html": "<ol><li>원기둥의 부피는 π×3²×8=72π cm³이다.</li><li>파낸 원뿔의 부피는 (1/3)×π×3²×6=18π cm³이다.</li><li>남은 부피는 72π−18π=54π cm³이다.</li></ol><p><strong>정답</strong>: ③ 54π cm³</p><p><strong>오답 기준</strong>: 원뿔 부피의 1/3과 “남은” 부피의 뺄셈을 모두 반영한다.</p>",
      "level": 13,
      "base_xp": 76,
      "state": "published"
    },
    {
      "external_key": "math70-v3-hard-008",
      "title": "8. 중2-1 일차함수와 절편",
      "body_html": "<p>일차함수 y=ax+b의 그래프가 점 (2,3)을 지나고 x축과 점 (4,0)에서 만난다. a+b의 값은?</p>",
      "diagram_svg": "",
      "grade": "중2",
      "semester": "2-1",
      "unit": "일차함수",
      "tags": [
        "2-1",
        "일차함수",
        "4점",
        "안전망 72점",
        "표준",
        "객관식"
      ],
      "answer_type": "choice",
      "choices": [
        "3/2",
        "5/2",
        "3",
        "4",
        "9/2"
      ],
      "answer_spec": {
        "correct_index": 4
      },
      "explanation_html": "<ol><li>두 점 (2,3), (4,0)을 지나는 직선의 기울기는 a=(0−3)/(4−2)=−3/2이다.</li><li>0=4a+b이므로 b=6이다.</li><li>a+b=−3/2+6=9/2이다.</li></ol><p><strong>정답</strong>: ⑤ 9/2</p><p><strong>오답 기준</strong>: x절편 4를 y절편으로 착각하지 않는다.</p>",
      "level": 14,
      "base_xp": 80,
      "state": "published"
    },